{
  "$schema": "http://json-schema.org/draft-07/schema#",
  "$id": "https://github.com/make-friends-globally/make-friends/profile.schema.json",
  "title": "make-friends profile",
  "description": "Self-introduction document for the make-friends federated social protocol (v1.0).",
  "type": "object",
  "additionalProperties": false,
  "required": ["protocolVersion", "name", "timezone", "lookingFor", "interests"],
  "properties": {
    "protocolVersion": {
      "type": "string",
      "const": "1.0",
      "description": "Protocol version this profile conforms to."
    },
    "name": {
      "type": "string",
      "minLength": 1,
      "maxLength": 60,
      "description": "Public display name or nickname."
    },
    "timezone": {
      "type": "string",
      "pattern": "^UTC[+-](0?[0-9]|1[0-4])(:30)?$",
      "description": "Simplified UTC offset, e.g. UTC+8, UTC-5:30."
    },
    "city": {
      "type": "string",
      "minLength": 2,
      "maxLength": 60,
      "description": "City-level location only. MUST NOT contain street-level precision."
    },
    "speaks": {
      "type": "array",
      "items": { "$ref": "#/definitions/language" },
      "minItems": 1,
      "maxItems": 10,
      "uniqueItems": true,
      "description": "Languages the member speaks."
    },
    "wantsToPractice": {
      "type": "array",
      "items": { "$ref": "#/definitions/language" },
      "maxItems": 10,
      "uniqueItems": true,
      "description": "Languages the member wants to practice (language-partner matching)."
    },
    "lookingFor": {
      "type": "array",
      "items": {
        "enum": ["language-partner", "collaborator", "mentor", "mentee", "local-friend", "cofounder", "chat"]
      },
      "minItems": 1,
      "maxItems": 7,
      "uniqueItems": true,
      "description": "Declared social intent; drives matching, filtering, and recommendations."
    },
    "offer": {
      "type": "array",
      "items": {
        "enum": ["mentoring", "code-review", "coffee", "language-practice", "hospitality"]
      },
      "maxItems": 5,
      "uniqueItems": true,
      "description": "What the member can give — social interaction is bidirectional."
    },
    "interests": {
      "type": "array",
      "items": {
        "type": "string",
        "minLength": 1,
        "maxLength": 40
      },
      "minItems": 1,
      "maxItems": 20,
      "uniqueItems": true,
      "description": "Free-form interest tags (tech stacks, hobbies, art, sports)."
    },
    "bestTimeToReach": {
      "enum": ["morning", "afternoon", "evening", "night", "flexible"],
      "description": "Preferred window for first contact."
    },
    "projectLinks": {
      "type": "array",
      "items": {
        "type": "string",
        "format": "uri",
        "pattern": "^https://"
      },
      "maxItems": 5,
      "description": "Public project / blog / portfolio links. MUST be https URLs."
    },
    "contact": {
      "type": "object",
      "additionalProperties": false,
      "properties": {
        "github": {
          "type": "string",
          "pattern": "^[A-Za-z0-9-]{1,39}$",
          "description": "GitHub username only. Email/phone MUST NOT be included."
        }
      },
      "description": "Public identity handles. Email/phone fields do not exist in the protocol."
    },
    "links": {
      "type": "array",
      "items": {
        "type": "string",
        "pattern": "^[A-Za-z0-9-]{1,39}$"
      },
      "maxItems": 200,
      "description": "GitHub usernames of confirmed friends (Link ceremony). MAY be empty; central links.json is authoritative."
    },
    "bio": {
      "type": "string",
      "maxLength": 500,
      "description": "Short free-text introduction. Optional; structured fields are preferred over prose."
    }
  },
  "definitions": {
    "language": {
      "type": "string",
      "pattern": "^[a-z]{2,3}(-[A-Z]{2})?$",
      "description": "ISO 639-1/639-2 code, optionally with ISO 3166-1 region, e.g. en, zh, en-US."
    }
  }
}
